{
  "$schema": "./schemas/domain-catalog.v1.schema.json",
  "schema_version": "lifeos.domain-catalog.v1",
  "shell_version": "lifeos.shell.v1",
  "active_domain_id": "food",
  "shell": {
    "tabs": ["today", "food", "chat"],
    "global_actions": ["search", "capture", "system"],
    "action_policy": "Direct reversible writes with Undo. Explicit confirmation only for sensitive or irreversible operations."
  },
  "domains": [
    {
      "id": "food",
      "label": "Food",
      "icon": "meal",
      "status": "active",
      "manifest": "./domains/food.v1.json",
      "skill": "./skills/food.md",
      "summary": "Meals, kitchen, recipes, shopping, spending and nutrition in one source-backed graph."
    },
    {
      "id": "health",
      "label": "Health",
      "icon": "favorite",
      "status": "preview",
      "summary": "Health Connect observations, goals, trends, plans and source-safe summaries."
    },
    {
      "id": "plants",
      "label": "Plants",
      "icon": "potted_plant",
      "status": "preview",
      "summary": "Plant profiles, care schedules, observations, supplies and journals."
    }
  ]
}
